"id","plaid_id","name","user_id"
"a0pb0uvixriasvgtx973zrtd","14002004","Healthcare, Physicians, Psychiatrists","user_2t7LPELjl3DoCTAUop6S5ONUFVL"
"a0vi23yrxz9vgiy5f7h7xlso","13005013","Food and Drink, Restaurants, Moroccan","user_2t7LPELjl3DoCTAUop6S5ONUFVL"
"a240y1baeqle4n9oeaavrrl9","19012001","Shops, Clothing and Accessories, Women's Store","user_2t7LPELjl3DoCTAUop6S5ONUFVL"
"a42ik9xzz1o323uq7z239fz9","14002012","Healthcare, Physicians, Neurologists","user_2t7LPELjl3DoCTAUop6S5ONUFVL"
"a4hktujqz24ty7yxudu9cm8f","13005005","Food and Drink, Restaurants, Swiss","user_2t7LPELjl3DoCTAUop6S5ONUFVL"
"a4n2t2wgj5iqneds53vcyi0j","18045007","Service, Personal Care, Manicures and Pedicures","user_2t7LPELjl3DoCTAUop6S5ONUFVL"
"a4yevvpl5gfyzsg4lftgke26","18064000","Service, Textiles","user_2t7LPELjl3DoCTAUop6S5ONUFVL"
"a6jt5nr8ss4r4hze3ud4mazp","17027001","Recreation, Parks, Playgrounds","user_2t7LPELjl3DoCTAUop6S5ONUFVL"
"a6vyupv0b6sl8nov740v822u","21010004","Transfer, Third Party, PayPal","user_2t7LPELjl3DoCTAUop6S5ONUFVL"
"a8ldp0z3ju1wna9hsqenippa","21010011","Transfer, Third Party, Plaid","user_2t7LPELjl3DoCTAUop6S5ONUFVL"
"a9txlgymt48g8hskntke2u74","18010000","Service, Chemicals and Gasses","user_2t7LPELjl3DoCTAUop6S5ONUFVL"
"adk8acz6757qt0t3p03zde96","13005045","Food and Drink, Restaurants, Caribbean","user_2t7LPELjl3DoCTAUop6S5ONUFVL"
"aec58uxn0zd94tmo2q85k5qo","17000000","Recreation","user_2t7LPELjl3DoCTAUop6S5ONUFVL"
"agh3gyga13ndu7ap6ymegqpd","12008006","Community, Education, Dance Schools","user_2t7LPELjl3DoCTAUop6S5ONUFVL"
"ah1r6hubc1nm050n9hcddieg","18019000","Service, Events and Event Planning","user_2t7LPELjl3DoCTAUop6S5ONUFVL"
"alko3gxx8py5qz2rrl4egr5k","18074000","Service, Art and Graphic Design","user_2t7LPELjl3DoCTAUop6S5ONUFVL"
"anjqhfb7k6ohq454etfdefr4","19040008","Shops, Outlet, Accessories Store","user_2t7LPELjl3DoCTAUop6S5ONUFVL"
"apkxyoozc2qi2uhi9d1lbe07","19008000","Shops, Boat Dealers","user_2t7LPELjl3DoCTAUop6S5ONUFVL"
"aq0nfcmgstw5bjxiq4vhk8mv","18037015","Service, Manufacturing, Rubber Products","user_2t7LPELjl3DoCTAUop6S5ONUFVL"
"aqzlg8t2rku2zxz9e6s7ip4m","17006000","Recreation, Boating","user_2t7LPELjl3DoCTAUop6S5ONUFVL"
"arlsc17189truzhrw1ra0fbc","18024001","Service, Home Improvement, Upholstery","user_2t7LPELjl3DoCTAUop6S5ONUFVL"
"arqpu3uq9e2t6e7edtdb6o0w","17031000","Recreation, Racquetball","user_2t7LPELjl3DoCTAUop6S5ONUFVL"
"as0s33sq6wj7e4fk7rf6ijeu","18024017","Service, Home Improvement, Home Inspection Services","user_2t7LPELjl3DoCTAUop6S5ONUFVL"
"as7gpjkcj7aea4ab7tbrprls","13004005","Food and Drink, Nightlife, Hookah Lounges","user_2t7LPELjl3DoCTAUop6S5ONUFVL"
"awg6a6mrhv7kyt99w3jx9dh7","22012005","Travel, Lodging, Cottages and Cabins","user_2t7LPELjl3DoCTAUop6S5ONUFVL"
"b1eg3plbhkv3c0bkwx1hmtve","18024014","Service, Home Improvement, Kitchens","user_2t7LPELjl3DoCTAUop6S5ONUFVL"
"b3fqncxh6p89enm67iy2z6nd","12011000","Community, Housing Assistance and Shelters","user_2t7LPELjl3DoCTAUop6S5ONUFVL"
"b4zdsj4lzzv9kf25v4081yl2","17024000","Recreation, Miniature Golf","user_2t7LPELjl3DoCTAUop6S5ONUFVL"
"b6f03ka3gszlz5v24vkw1krp","12008000","Community, Education","user_2t7LPELjl3DoCTAUop6S5ONUFVL"
"b6vor1f0u1eenjgz7bs9wmq0","12008004","Community, Education, Fraternities and Sororities","user_2t7LPELjl3DoCTAUop6S5ONUFVL"
"b8qh69g2je9o9tmqxsc8mj1t","22001000","Travel, Airlines and Aviation Services","user_2t7LPELjl3DoCTAUop6S5ONUFVL"
"b919npi1yga1gikns1rzyfqz","22006000","Travel, Car Service","user_2t7LPELjl3DoCTAUop6S5ONUFVL"
"b9ey6wecqxri4japmkbc4hyr","19040002","Shops, Outlet, Swimwear","user_2t7LPELjl3DoCTAUop6S5ONUFVL"
"b9gx11lvpj2nfq4phnicagwz","18024005","Service, Home Improvement, Roofers","user_2t7LPELjl3DoCTAUop6S5ONUFVL"
"b9nj3qmoyyqlnwio7e8toris","17003000","Recreation, Baseball","user_2t7LPELjl3DoCTAUop6S5ONUFVL"
"bb65u7jpwnum05mj1s3r8kmo","13005057","Food and Drink, Restaurants, American","user_2t7LPELjl3DoCTAUop6S5ONUFVL"
"bdeg3hbnijqhfwxqcmx4tfjt","17042000","Recreation, Sports Clubs","user_2t7LPELjl3DoCTAUop6S5ONUFVL"
"bf5ys6wtgvq47okxkyzmjvx0","17025003","Recreation, Outdoors, Lakes","user_2t7LPELjl3DoCTAUop6S5ONUFVL"
"bhpfgzvzv78cx49n9w9nsx5n","18020011","Service, Financial, Business Brokers and Franchises","user_2t7LPELjl3DoCTAUop6S5ONUFVL"
"bi46hakx4irpk0ugp72793g6","18049000","Service, Rail","user_2t7LPELjl3DoCTAUop6S5ONUFVL"
"bionsp5bgrf47p1pgzd8fjbt","17046000","Recreation, Water Sports","user_2t7LPELjl3DoCTAUop6S5ONUFVL"
"bjo9ief75379po9lu28s77s4","18013009","Service, Construction, Carpet and Flooring","user_2t7LPELjl3DoCTAUop6S5ONUFVL"
"bkkxx0gcw1hrobbzadogbq1k","14001016","Healthcare, Healthcare Services, Alternative Medicine","user_2t7LPELjl3DoCTAUop6S5ONUFVL"
"bkzpj9gt42ohdkinyrspwz6i","19007000","Shops, Bicycles","user_2t7LPELjl3DoCTAUop6S5ONUFVL"
"bnt84fl0wzsi1r98azxouloy","13004001","Food and Drink, Nightlife, Strip Club","user_2t7LPELjl3DoCTAUop6S5ONUFVL"
"bockmbbxquk85tpdejtchvi5","13005056","Food and Drink, Restaurants, Asian","user_2t7LPELjl3DoCTAUop6S5ONUFVL"
"btbhyn121efjmmj639n89mf4","18012001","Service, Computers, Maintenance and Repair","user_2t7LPELjl3DoCTAUop6S5ONUFVL"
"btrzq5r5ht6x2vbzr21o59hc","12002002","Community, Assisted Living Services, Caretakers","user_2t7LPELjl3DoCTAUop6S5ONUFVL"
"bu7oc7vslji82qffa2qlx35r","12015002","Community, Organizations and Associations, Environmental","user_2t7LPELjl3DoCTAUop6S5ONUFVL"
"bv6wlrjmkjyb94htzn3shxqu","13005011","Food and Drink, Restaurants, Portuguese","user_2t7LPELjl3DoCTAUop6S5ONUFVL"
"byblpv2xgpsq7e7q4r606h49","17002000","Recreation, Athletic Fields","user_2t7LPELjl3DoCTAUop6S5ONUFVL"
"bz19yuucgjnv58c3xvpllgod","19006000","Shops, Beauty Products","user_2t7LPELjl3DoCTAUop6S5ONUFVL"
"c085b4ejzni9b3m4y2s2c7hs","18050008","Service, Real Estate, Boarding Houses","user_2t7LPELjl3DoCTAUop6S5ONUFVL"
"c1wmz6d5mxqgxd55qdyhev2y","14002005","Healthcare, Physicians, Plastic Surgeons","user_2t7LPELjl3DoCTAUop6S5ONUFVL"
"c42xsneehw0z8dkmafp01dxo","18035000","Service, Machine Shops","user_2t7LPELjl3DoCTAUop6S5ONUFVL"
"c5jlx0mhr2wlivf01nh1zzep","17023002","Recreation, Landmarks, Historic Sites","user_2t7LPELjl3DoCTAUop6S5ONUFVL"
"c6iv4kf67brtuapeux5awz6t","19040004","Shops, Outlet, Men's Store","user_2t7LPELjl3DoCTAUop6S5ONUFVL"
"c6rzmfp1beczz92wfkjuppim","22004000","Travel, Bus Stations","user_2t7LPELjl3DoCTAUop6S5ONUFVL"
"c796tss9xta3q4csvtc0atjv","18037010","Service, Manufacturing, Metal Products","user_2t7LPELjl3DoCTAUop6S5ONUFVL"
"c8ks9g37j6vzp1ivsefgb8vh","19001000","Shops, Adult","user_2t7LPELjl3DoCTAUop6S5ONUFVL"
"c9f0s8m7xb14wctxchcwz1q1","16003000","Payment, Loan","user_2t7LPELjl3DoCTAUop6S5ONUFVL"
"ca6e2d2f0zuc3qtweaqqqlmx","13003000","Food and Drink, Internet Cafes","user_2t7LPELjl3DoCTAUop6S5ONUFVL"
"cbvbwk6x9p6t4i3rcr8rzq2w","12008005","Community, Education, Driving Schools","user_2t7LPELjl3DoCTAUop6S5ONUFVL"
"cejubdljflv4ffn32rj9p6z7","17001019","Recreation, Arts and Entertainment, Aquarium","user_2t7LPELjl3DoCTAUop6S5ONUFVL"
"ceysjn1gw4qqzj2tnqz4a4ul","18068003","Service, Utilities, Heating, Ventilating, and Air Conditioning","user_2t7LPELjl3DoCTAUop6S5ONUFVL"
"cf5xnn1fjuasffmpr0046w54","18024000","Service, Home Improvement","user_2t7LPELjl3DoCTAUop6S5ONUFVL"
"cimzej19njitnxfuo7z85ggl","13005059","Food and Drink, Restaurants, Afghan","user_2t7LPELjl3DoCTAUop6S5ONUFVL"
"cjl7wg8l0734ltyxgdb2xohp","18001006","Service, Advertising and Marketing, Online Advertising","user_2t7LPELjl3DoCTAUop6S5ONUFVL"
"cjlueps6uhspa1rhyg24bvpz","14002018","Healthcare, Physicians, Dermatologists","user_2t7LPELjl3DoCTAUop6S5ONUFVL"
"cjv3km1gwdsw3wdiznchzwz3","12002001","Community, Assisted Living Services, Facilities and Nursing Homes","user_2t7LPELjl3DoCTAUop6S5ONUFVL"
"cmef83eoiyv01qdduocioon4","14001001","Healthcare, Healthcare Services, Psychologists","user_2t7LPELjl3DoCTAUop6S5ONUFVL"
"cnjjxks0oe104o1s4o0n3lus","18012000","Service, Computers","user_2t7LPELjl3DoCTAUop6S5ONUFVL"
"coylz9mi2z2hwbeytuin10j7","19052000","Shops, Wedding and Bridal","user_2t7LPELjl3DoCTAUop6S5ONUFVL"
"cs4d7ibrdjc1ndhbo9hdrq1x","13005034","Food and Drink, Restaurants, Ethiopian","user_2t7LPELjl3DoCTAUop6S5ONUFVL"
"cshxenl8qvrwfac1ywyxtccf","18024003","Service, Home Improvement, Swimming Pool Maintenance and Services","user_2t7LPELjl3DoCTAUop6S5ONUFVL"
"cu4d9im9fdy52z1511a71lni","18055000","Service, Rubber","user_2t7LPELjl3DoCTAUop6S5ONUFVL"
"cwj89rl0tszomuduzrri2qy0","19031000","Shops, Hobby and Collectibles","user_2t7LPELjl3DoCTAUop6S5ONUFVL"
"cxa3qu28kldvc1axpfzdnfg3","17001017","Recreation, Arts and Entertainment, Art Dealers and Galleries","user_2t7LPELjl3DoCTAUop6S5ONUFVL"
"cygnb393wh4s45fp2zwese0b","21012000","Transfer, Withdrawal","user_2t7LPELjl3DoCTAUop6S5ONUFVL"
"czuusjjnp9ubauaw4fip21rt","22015000","Travel, Rail","user_2t7LPELjl3DoCTAUop6S5ONUFVL"
"d1zvinw1uf5zh7cwqrld94yc","18040001","Service, Mining, Coal","user_2t7LPELjl3DoCTAUop6S5ONUFVL"
"d2eo3l2sh8jgi3l8fqx2a4tz","17023000","Recreation, Landmarks","user_2t7LPELjl3DoCTAUop6S5ONUFVL"
"d2wbjnwhsu9npca8yf1jemo0","18024008","Service, Home Improvement, Pest Control","user_2t7LPELjl3DoCTAUop6S5ONUFVL"
"d6teyceicm55tkrrw41d2v4k","19019000","Shops, Digital Purchase","user_2t7LPELjl3DoCTAUop6S5ONUFVL"
"d7hxduqby2uhc89jnuypllw7","13005054","Food and Drink, Restaurants, Bagel Shop","user_2t7LPELjl3DoCTAUop6S5ONUFVL"
"ddtw3tyik9yvu7oaegxcox0h","14002008","Healthcare, Physicians, Orthopedic Surgeons","user_2t7LPELjl3DoCTAUop6S5ONUFVL"
"dep2xs2q0k3n7gpz4gwtbggr","10006000","Bank Fees, Wire Transfer","user_2t7LPELjl3DoCTAUop6S5ONUFVL"
"dg3zebialhdgixs55pmy5nxz","21002000","Transfer, ACH","user_2t7LPELjl3DoCTAUop6S5ONUFVL"
"dgi4xa8zhz5noirogy68nm7x","17033000","Recreation, Recreation Centers","user_2t7LPELjl3DoCTAUop6S5ONUFVL"
"dgllphi2ikf8bprlyozweq3l","18001009","Service, Advertising and Marketing, Creative Services","user_2t7LPELjl3DoCTAUop6S5ONUFVL"
"dime4e6qxf6icw5fllp2feh8","19040006","Shops, Outlet, Kids' Store","user_2t7LPELjl3DoCTAUop6S5ONUFVL"
"diypxfthsy7l9dn05bo0zu8d","13005009","Food and Drink, Restaurants, Seafood","user_2t7LPELjl3DoCTAUop6S5ONUFVL"
"dk0wneb8c23nlx35941d49aa","17023004","Recreation, Landmarks, Buildings and Structures","user_2t7LPELjl3DoCTAUop6S5ONUFVL"
"dkztdr4hepwc0qi1zebyrx5p","17019000","Recreation, Hiking","user_2t7LPELjl3DoCTAUop6S5ONUFVL"
"dnzm2a7eszgtg4km4exgv1cq","14002013","Healthcare, Physicians, Internal Medicine","user_2t7LPELjl3DoCTAUop6S5ONUFVL"
"doh3pu8htskxpsnox3stadoa","14000000","Healthcare","user_2t7LPELjl3DoCTAUop6S5ONUFVL"
"dp1xqbwgyzsff1evmch6ixe0","22009000","Travel, Gas Stations","user_2t7LPELjl3DoCTAUop6S5ONUFVL"
"dqmxre3k88bbq75fjvzzin6l","21007000","Transfer, Deposit","user_2t7LPELjl3DoCTAUop6S5ONUFVL"
"dr0llrjwya1hyiil2giz8tum","18006004","Service, Automotive, Car Wash and Detail","user_2t7LPELjl3DoCTAUop6S5ONUFVL"
"dr70u98hefulzruours8ad8h","18020000","Service, Financial","user_2t7LPELjl3DoCTAUop6S5ONUFVL"
"dui6sgumvlc867xfzxobdhmi","17032000","Recreation, Rafting","user_2t7LPELjl3DoCTAUop6S5ONUFVL"
"dvl0z9tlw095ti77tj9t9pmj","18024024","Service, Home Improvement, Contractors","user_2t7LPELjl3DoCTAUop6S5ONUFVL"
"dwuw6daj56gzif631qus6017","18020007","Service, Financial, Financial Planning and Investments","user_2t7LPELjl3DoCTAUop6S5ONUFVL"
"dwuwth2cm7kexy9zxbfbw72u","19000000","Shops","user_2t7LPELjl3DoCTAUop6S5ONUFVL"
"dz2r8k3tusprt5ud01if28fp","19025002","Shops, Food and Beverage Store, Health Food","user_2t7LPELjl3DoCTAUop6S5ONUFVL"
"e02q32xngurjb6hp8ha1xjt5","19028000","Shops, Gift and Novelty","user_2t7LPELjl3DoCTAUop6S5ONUFVL"
"e33xw9qphajrywwobgczkvcr","17022000","Recreation, Hunting and Fishing","user_2t7LPELjl3DoCTAUop6S5ONUFVL"
"e3hiqfxjc16o01k3qz4lv1rq","12012001","Community, Law Enforcement, Police Stations","user_2t7LPELjl3DoCTAUop6S5ONUFVL"
"e6c05lnfylw9s13a1538jiru","17038000","Recreation, Skydiving","user_2t7LPELjl3DoCTAUop6S5ONUFVL"
"e6uf79qheina24t67r9xx1wc","13005038","Food and Drink, Restaurants, Diners","user_2t7LPELjl3DoCTAUop6S5ONUFVL"
"e70kf33rh41xeod3w1t29rcy","17001007","Recreation, Arts and Entertainment, Music and Show Venues","user_2t7LPELjl3DoCTAUop6S5ONUFVL"
"e7rn9a2jur1hxtyy3bu7qsic","19011000","Shops, Children","user_2t7LPELjl3DoCTAUop6S5ONUFVL"
"e80nvempa84pw3gdlax1l1gx","19025003","Shops, Food and Beverage Store, Farmers Markets","user_2t7LPELjl3DoCTAUop6S5ONUFVL"
"e9yr8f260pn1wazq94jk9r9m","13005008","Food and Drink, Restaurants, Spanish","user_2t7LPELjl3DoCTAUop6S5ONUFVL"
"e9zt15rozax2o2904fks3tqe","18024019","Service, Home Improvement, Heating, Ventilation and Air Conditioning","user_2t7LPELjl3DoCTAUop6S5ONUFVL"
"ec5mn4halaz6wd8sg5yt8mfv","18066000","Service, Transportation","user_2t7LPELjl3DoCTAUop6S5ONUFVL"
"egqynqi6pvxc5226ddyc9xr3","22005000","Travel, Car and Truck Rentals","user_2t7LPELjl3DoCTAUop6S5ONUFVL"
"egzk44035jys233b8592ebc1","17001016","Recreation, Arts and Entertainment, Billiards and Pool","user_2t7LPELjl3DoCTAUop6S5ONUFVL"
"el8vuxp1md9fbmmujxcdvfyt","19030000","Shops, Hardware Store","user_2t7LPELjl3DoCTAUop6S5ONUFVL"
"en7p2mnlmlbqzp6yaewr67n9","17021000","Recreation, Hot Air Balloons","user_2t7LPELjl3DoCTAUop6S5ONUFVL"
"eojp22kyr1ruayamd1mq56k0","18045006","Service, Personal Care, Massage Clinics and Therapists","user_2t7LPELjl3DoCTAUop6S5ONUFVL"
"ep15jyvlaiinuu2rwuqio1ks","18070000","Service, Water and Waste Management","user_2t7LPELjl3DoCTAUop6S5ONUFVL"
"ep8tir180bxzx4p4ab0hsqeu","20000000","Tax","user_2t7LPELjl3DoCTAUop6S5ONUFVL"
"epyws3bsbjohihw93nh8le0e","13005050","Food and Drink, Restaurants, Breakfast Spot","user_2t7LPELjl3DoCTAUop6S5ONUFVL"
"eq9rz1x9f29cd0uubhavtbil","12012003","Community, Law Enforcement, Correctional Institutions","user_2t7LPELjl3DoCTAUop6S5ONUFVL"
"er3moenqo20witptg70wo0f0","14001005","Healthcare, Healthcare Services, Optometrists","user_2t7LPELjl3DoCTAUop6S5ONUFVL"
"erepyiqp9skroje9rectpz1d","17012000","Recreation, Equestrian","user_2t7LPELjl3DoCTAUop6S5ONUFVL"
"evdser9ghriblhj34nlj2hgt","18021000","Service, Food and Beverage","user_2t7LPELjl3DoCTAUop6S5ONUFVL"
"evwisdo6dkigkwjgkf3ri4m3","18030000","Service, Insurance","user_2t7LPELjl3DoCTAUop6S5ONUFVL"
"exazro2wlpshs2oqmtnmkb3k","18045005","Service, Personal Care, Piercing","user_2t7LPELjl3DoCTAUop6S5ONUFVL"
"eyz155broiqfb68ypoqzmi66","13004003","Food and Drink, Nightlife, Karaoke","user_2t7LPELjl3DoCTAUop6S5ONUFVL"
"ez18lacphipk6konbcj3wavc","18020005","Service, Financial, Holding and Investment Offices","user_2t7LPELjl3DoCTAUop6S5ONUFVL"
"ezcqggmxklf2et182ilnbc2u","17044000","Recreation, Swimming","user_2t7LPELjl3DoCTAUop6S5ONUFVL"
"f13kpvr0ky0lqnntqj0vuvzz","18071000","Service, Web Design and Development","user_2t7LPELjl3DoCTAUop6S5ONUFVL"
"f30oux867oemfm4fcq8ph81n","18024012","Service, Home Improvement, Lighting Fixtures","user_2t7LPELjl3DoCTAUop6S5ONUFVL"
"f4zm06tv97f4ah6j1blywqux","18013006","Service, Construction, Heating, Ventilating and Air Conditioning","user_2t7LPELjl3DoCTAUop6S5ONUFVL"
"f6pe2ya837akcjkmpw0jj4vd","13005004","Food and Drink, Restaurants, Thai","user_2t7LPELjl3DoCTAUop6S5ONUFVL"
"fbww67uvvwk777uwro6akgk3","18058000","Service, Shipping and Freight","user_2t7LPELjl3DoCTAUop6S5ONUFVL"
"fbx0wkhvqoxhduvpq5059m3i","13005035","Food and Drink, Restaurants, Eastern European","user_2t7LPELjl3DoCTAUop6S5ONUFVL"
"ff492ukz6q5t1dbose5lcvya","18024007","Service, Home Improvement, Plumbing","user_2t7LPELjl3DoCTAUop6S5ONUFVL"
"fgpvrwy46qm7t5cfjupvxmln","19048000","Shops, Tobacco","user_2t7LPELjl3DoCTAUop6S5ONUFVL"
"fgzm0mgm6f55mov41n8pzuop","17017000","Recreation, Gymnastics","user_2t7LPELjl3DoCTAUop6S5ONUFVL"
"fi140eas2bxz09ui9blubtcw","13005031","Food and Drink, Restaurants, Filipino","user_2t7LPELjl3DoCTAUop6S5ONUFVL"
"fn1v5e4fcyzgpvzi560lefl0","19034000","Shops, Luggage","user_2t7LPELjl3DoCTAUop6S5ONUFVL"
"fnzf542z3xthuirjvnh7g2ar","18054000","Service, Research","user_2t7LPELjl3DoCTAUop6S5ONUFVL"
"fono2r91q8o1bmkyazo1nb02","18029000","Service, Industrial Machinery and Vehicles","user_2t7LPELjl3DoCTAUop6S5ONUFVL"
"ftjws0kppptmu07guv694vpm","18024009","Service, Home Improvement, Painting","user_2t7LPELjl3DoCTAUop6S5ONUFVL"
"ftne4l960hkfwzyi8darragp","17043000","Recreation, Stadiums and Arenas","user_2t7LPELjl3DoCTAUop6S5ONUFVL"
"ftnw0glhm0z4lr0smpbpua38","18024010","Service, Home Improvement, Movers","user_2t7LPELjl3DoCTAUop6S5ONUFVL"
"fwgo7o2hute0n2p5w08oo09g","19005002","Shops, Automotive, Salvage Yards","user_2t7LPELjl3DoCTAUop6S5ONUFVL"
"fwskmpwq51msxoffgx0s24t8","13005015","Food and Drink, Restaurants, Mexican","user_2t7LPELjl3DoCTAUop6S5ONUFVL"
"fx2r352ryxhstp3yyhq8t205","18017000","Service, Engineering","user_2t7LPELjl3DoCTAUop6S5ONUFVL"
"fxc9cux19v414288gu2yil0v","18041000","Service, News Reporting","user_2t7LPELjl3DoCTAUop6S5ONUFVL"
"fyls81g7aqaagvmkjk640r3r","18038000","Service, Media Production","user_2t7LPELjl3DoCTAUop6S5ONUFVL"
"g1s1swzqxmehzyni0r55qizw","18013000","Service, Construction","user_2t7LPELjl3DoCTAUop6S5ONUFVL"
"g4orrjkrbigtivzcvfzhqp94","18020012","Service, Financial, Banking and Finance","user_2t7LPELjl3DoCTAUop6S5ONUFVL"
"g5412cg40f2c4s16fx93dq3r","18001002","Service, Advertising and Marketing, Search Engine Marketing and Optimization","user_2t7LPELjl3DoCTAUop6S5ONUFVL"
"g54j4yhthk9m304twqrbsqf5","13005017","Food and Drink, Restaurants, Latin American","user_2t7LPELjl3DoCTAUop6S5ONUFVL"
"g6bzovpizxp2uda3lz3uxdpc","18020013","Service, Financial, ATMs","user_2t7LPELjl3DoCTAUop6S5ONUFVL"
"g8alqlio8qq9tfgj522jxo7p","13005043","Food and Drink, Restaurants, Coffee Shop","user_2t7LPELjl3DoCTAUop6S5ONUFVL"
"gc6qd9zjkbqebrkb3uamf28m","17010000","Recreation, Cycling","user_2t7LPELjl3DoCTAUop6S5ONUFVL"
"gj6qxb49utcujh04clzjcotz","18001004","Service, Advertising and Marketing, Promotional Items","user_2t7LPELjl3DoCTAUop6S5ONUFVL"
"gl8e9py9gfjfjeo3fetcb93q","21010009","Transfer, Third Party, Digit","user_2t7LPELjl3DoCTAUop6S5ONUFVL"
"gnk1hlacpvd2bfsravalxtc3","12004000","Community, Courts","user_2t7LPELjl3DoCTAUop6S5ONUFVL"
"go9q3aco4zqxetx5xngbmomq","13005030","Food and Drink, Restaurants, Fish and Chips","user_2t7LPELjl3DoCTAUop6S5ONUFVL"
"gt0dlkfj0259wumxeckfkalx","12016000","Community, Post Offices","user_2t7LPELjl3DoCTAUop6S5ONUFVL"
"gtgdf1qx9kcrl8nlkw7sryka","19038000","Shops, Newsstands","user_2t7LPELjl3DoCTAUop6S5ONUFVL"
"gvrbxo5tizf2loq5yabfr85f","13005000","Food and Drink, Restaurants","user_2t7LPELjl3DoCTAUop6S5ONUFVL"
"gzpu9rrsnb56fgg0s061yvue","14002002","Healthcare, Physicians, Respiratory","user_2t7LPELjl3DoCTAUop6S5ONUFVL"
"gzrq82pfi4hce86xiydazee3","14001012","Healthcare, Healthcare Services, Dentists","user_2t7LPELjl3DoCTAUop6S5ONUFVL"
"h0y9m1csn0bpties0chz43q0","10008000","Bank Fees, Cash Advance","user_2t7LPELjl3DoCTAUop6S5ONUFVL"
"h2e84fk3ba4gtqjwki32vr57","12001000","Community, Animal Shelter","user_2t7LPELjl3DoCTAUop6S5ONUFVL"
"h2v00lgneh4tikasgn76y3cf","18045000","Service, Personal Care","user_2t7LPELjl3DoCTAUop6S5ONUFVL"
"h36x96leoha77i01oguisbn3","17025002","Recreation, Outdoors, Mountains","user_2t7LPELjl3DoCTAUop6S5ONUFVL"
"h3if2uwg2iqx2fti1bigq4p4","12018004","Community, Religious, Churches","user_2t7LPELjl3DoCTAUop6S5ONUFVL"
"h4vgrksfhyenpxu9ebg2bb5w","13005025","Food and Drink, Restaurants, Greek","user_2t7LPELjl3DoCTAUop6S5ONUFVL"
"h5ky93vwcykqksl0nob2iyvl","13005023","Food and Drink, Restaurants, Indian","user_2t7LPELjl3DoCTAUop6S5ONUFVL"
"h6cs6q5sygpjosoytjktslm0","18015000","Service, Dating and Escort","user_2t7LPELjl3DoCTAUop6S5ONUFVL"
"h9exq6pf3snklxfgwssgg03q","18008000","Service, Business Services","user_2t7LPELjl3DoCTAUop6S5ONUFVL"
"hbpp8kr7yivm5ftkqhaens96","19003000","Shops, Arts and Crafts","user_2t7LPELjl3DoCTAUop6S5ONUFVL"
"hclngbaki2te7jabq1ewvt9g","18024020","Service, Home Improvement, Hardware and Services","user_2t7LPELjl3DoCTAUop6S5ONUFVL"
"hcmzjg3hvlj2cdzny0y3ecw6","14001015","Healthcare, Healthcare Services, Blood Banks and Centers","user_2t7LPELjl3DoCTAUop6S5ONUFVL"
"hddt33yvt60v4ksx9b99ff34","18024018","Service, Home Improvement, Home Appliances","user_2t7LPELjl3DoCTAUop6S5ONUFVL"
"hds4prxwut978if4z0u37bei","14002011","Healthcare, Physicians, Obstetricians and Gynecologists","user_2t7LPELjl3DoCTAUop6S5ONUFVL"
"hf2wwmdv7y6h3f5aapd4vl00","17018000","Recreation, Gyms and Fitness Centers","user_2t7LPELjl3DoCTAUop6S5ONUFVL"
"hgvukx5m2zwh91mn2qetlevd","22002000","Travel, Airports","user_2t7LPELjl3DoCTAUop6S5ONUFVL"
"hgw3ka4lebktq7wrw54wltnt","17001012","Recreation, Arts and Entertainment, Dance Halls and Saloons","user_2t7LPELjl3DoCTAUop6S5ONUFVL"
"hgy17pt0v9nxdlufo2b9xfyh","18050004","Service, Real Estate, Property Management","user_2t7LPELjl3DoCTAUop6S5ONUFVL"
"hhn8svd0m2licg99vpba3304","12002000","Community, Assisted Living Services","user_2t7LPELjl3DoCTAUop6S5ONUFVL"
"hhybwve6ylf32uz2m8kytatg","18006008","Service, Automotive, Auto Smog Check","user_2t7LPELjl3DoCTAUop6S5ONUFVL"
"hk5soqvijonbpyrkmqqg2lyu","18053000","Service, Repair Services","user_2t7LPELjl3DoCTAUop6S5ONUFVL"
"hkioa6aavcbrdz7753px1nvn","18024027","Service, Home Improvement, Architects","user_2t7LPELjl3DoCTAUop6S5ONUFVL"
"hmabh5p03vbcfskckbop1uyq","12015003","Community, Organizations and Associations, Charities and Non-Profits","user_2t7LPELjl3DoCTAUop6S5ONUFVL"
"hmq7rbnowe7usqiei134mh6p","12008003","Community, Education, Primary and Secondary Schools","user_2t7LPELjl3DoCTAUop6S5ONUFVL"
"hmwnr1ug7teb4ymig97m2vh2","17001008","Recreation, Arts and Entertainment, Museums","user_2t7LPELjl3DoCTAUop6S5ONUFVL"
"hnh7d1z8gow6hfqnzfv5shkc","19005005","Shops, Automotive, Classic and Antique Car","user_2t7LPELjl3DoCTAUop6S5ONUFVL"
"hs0jqubnbwqx10c2qgfqhxkh","19036000","Shops, Music, Video and DVD","user_2t7LPELjl3DoCTAUop6S5ONUFVL"
"hsguvo51oyo5mruacy251gu0","12008001","Community, Education, Vocational Schools","user_2t7LPELjl3DoCTAUop6S5ONUFVL"
"htuks9pfeiwm7znhxshi2wro","22012006","Travel, Lodging, Bed and Breakfasts","user_2t7LPELjl3DoCTAUop6S5ONUFVL"
"hvl55g7q2nteaq8vqlrbt2zp","18037019","Service, Manufacturing, Transportation Equipment","user_2t7LPELjl3DoCTAUop6S5ONUFVL"
"hwhbu1jyplm27uv1jv6o48s7","18043000","Service, Packaging","user_2t7LPELjl3DoCTAUop6S5ONUFVL"
"hwycsket9si44vvl6jo4npyo","13005041","Food and Drink, Restaurants, Cupcake Shop","user_2t7LPELjl3DoCTAUop6S5ONUFVL"
"hxxiphon0c1w7vxb2k67q34e","19015000","Shops, Convenience Stores","user_2t7LPELjl3DoCTAUop6S5ONUFVL"
"hzvtlyvvk3ntjxu2qfwss6vy","18006007","Service, Automotive, Auto Tires","user_2t7LPELjl3DoCTAUop6S5ONUFVL"
"i1d7emdrm9dg1rvktmeoi73n","17007000","Recreation, Campgrounds and RV Parks","user_2t7LPELjl3DoCTAUop6S5ONUFVL"
"i1r2pv4gvhqk2fpdc1q32kp6","13001002","Food and Drink, Bar, Sports Bar","user_2t7LPELjl3DoCTAUop6S5ONUFVL"
"i2ihl6xv5t9tlgdxa5ow497p","18037016","Service, Manufacturing, Service Instruments","user_2t7LPELjl3DoCTAUop6S5ONUFVL"
"i2jkj6gp5qx7yjyftdjp0qbd","18020014","Service, Financial, Accounting and Bookkeeping","user_2t7LPELjl3DoCTAUop6S5ONUFVL"
"i4gr21g79hncstrdaedaeyei","17001002","Recreation, Arts and Entertainment, Symphony and Opera","user_2t7LPELjl3DoCTAUop6S5ONUFVL"
"i6ujc26cx4bdj203y2g9nzna","17036000","Recreation, Scuba Diving","user_2t7LPELjl3DoCTAUop6S5ONUFVL"
"i8vgs8k3r1y9ip7ecc1d5p5a","21007001","Transfer, Deposit, Check","user_2t7LPELjl3DoCTAUop6S5ONUFVL"
"ihthl0vvwz35a0hn3173zlz4","13005047","Food and Drink, Restaurants, Cafe","user_2t7LPELjl3DoCTAUop6S5ONUFVL"
"ilsiud4tprgehsm5cyt8yqv6","19002000","Shops, Antiques","user_2t7LPELjl3DoCTAUop6S5ONUFVL"
"iltt8sipd9qgzmlgn9xctcvc","18022000","Service, Funeral Services","user_2t7LPELjl3DoCTAUop6S5ONUFVL"
"im6ip41zhzfcfy81zggus34x","17004000","Recreation, Basketball","user_2t7LPELjl3DoCTAUop6S5ONUFVL"
"imxxjuyfjhb43xiqq1w43knq","17001011","Recreation, Arts and Entertainment, Entertainment","user_2t7LPELjl3DoCTAUop6S5ONUFVL"
"iol4j4d3062zo9qrbkjb16rb","18073001","Service, Agriculture and Forestry, Crop Production","user_2t7LPELjl3DoCTAUop6S5ONUFVL"
"ip4grgbnj84b7l25smv5zhpm","18068004","Service, Utilities, Gas","user_2t7LPELjl3DoCTAUop6S5ONUFVL"
"iqnkvl5vhu9hngc3m2fj8pvs","12000000","Community","user_2t7LPELjl3DoCTAUop6S5ONUFVL"
"ir450qsrzs9a05tko64teow9","18037003","Service, Manufacturing, Computers and Office Machines","user_2t7LPELjl3DoCTAUop6S5ONUFVL"
"is2r1upif0des0265zog5cu6","18037007","Service, Manufacturing, Glass Products","user_2t7LPELjl3DoCTAUop6S5ONUFVL"
"is5s084b0uc36k91m8mo0rgx","14001009","Healthcare, Healthcare Services, Medical Supplies and Labs","user_2t7LPELjl3DoCTAUop6S5ONUFVL"
"it3hbqf0s21yplikxf8750tm","14001003","Healthcare, Healthcare Services, Podiatrists","user_2t7LPELjl3DoCTAUop6S5ONUFVL"
"ivl850wcxf5yi8sjovebjrwu","14001013","Healthcare, Healthcare Services, Counseling and Therapy","user_2t7LPELjl3DoCTAUop6S5ONUFVL"
"iwco53zdqq3wzs84s7c7pkju","18032000","Service, Leather","user_2t7LPELjl3DoCTAUop6S5ONUFVL"
"ixnga7id9kosxyotmpsurv5c","14002019","Healthcare, Physicians, Cardiologists","user_2t7LPELjl3DoCTAUop6S5ONUFVL"
"iybcia3xs871iilr0kzlz3ko","13004000","Food and Drink, Nightlife","user_2t7LPELjl3DoCTAUop6S5ONUFVL"
"j0a1xjakovlptmr4hlyfkzgz","18020008","Service, Financial, Credit Reporting","user_2t7LPELjl3DoCTAUop6S5ONUFVL"
"j164b94homcr3jtl1db4ud22","18020009","Service, Financial, Collections","user_2t7LPELjl3DoCTAUop6S5ONUFVL"
"j1v4hcgtl7i6ffbvp6givh0x","18013002","Service, Construction, Roofers","user_2t7LPELjl3DoCTAUop6S5ONUFVL"
"j6ab41qoex11vcukuepok5lz","17045000","Recreation, Tennis","user_2t7LPELjl3DoCTAUop6S5ONUFVL"
"j7rd4fzzydnmmbyhoiqx9me5","13005014","Food and Drink, Restaurants, Middle Eastern","user_2t7LPELjl3DoCTAUop6S5ONUFVL"
"j9345u3utn3j1pvoc2tt2qku","17027003","Recreation, Parks, Natural Parks","user_2t7LPELjl3DoCTAUop6S5ONUFVL"
"jbzf95o6foppt9c23tts82np","19013003","Shops, Computers and Electronics, Cameras","user_2t7LPELjl3DoCTAUop6S5ONUFVL"
